state,dem_candidate,gop_candidate,current_holder,polling_margin_dem,fundamentals_margin_dem,elasticity,state_elasticity,dem_win_counts_for_seat_change,race_tier,notes,tier_error_multiplier,polling_active,candidate_status_as_of,poll_count,latest_poll_end_date,avg_poll_age_days,election_system,rcv_enabled,rcv_transfer_dem_from_ind,rcv_transfer_rep_from_ind,rcv_exhaust_from_ind,rcv_transfer_dem_from_other,rcv_transfer_rep_from_other,rcv_exhaust_from_other,pres_2024_margin_dem,pres_2020_margin_dem,pres_2016_margin_dem,state_partisan_baseline_dem,national_environment_margin_dem,state_environment_adjustment_dem,incumbency_adjustment_dem,candidate_quality_adjustment_dem,special_adjustment_dem,fundamentals_notes,bayesian_posterior_sd,pre_bayes_model_margin_dem,holder_normalized,baseline_source,dem_nominee_confirmed,gop_nominee_confirmed,dem_prior_elected_office,gop_prior_elected_office,dem_prior_statewide_win,gop_prior_statewide_win,dem_prior_overperformance,gop_prior_overperformance,dem_candidate_liability,gop_candidate_liability,prior_elected_experience_adjustment_dem,prior_statewide_win_adjustment_dem,overperformance_adjustment_dem,candidate_liability_adjustment_dem,candidate_quality_gate,candidate_quality_notes,manual_candidate_quality_adjustment_dem,objective_candidate_quality_adjustment_dem,candidate_quality_manual_note,total_poll_weight,polling_margin_used,original_bayesian_polling_weight,poll_count_weight_multiplier,cycle_max_polling_weight,fundamentals_default_candidate_quality_adjustment_dem,fundamentals_component_sum_dem,incumbency_rationale,candidate_quality_rationale,overperformance_rationale,liability_rationale,special_adjustment_rationale,last_human_review_date,human_review_status,national_environment_adjustment_dem,state_scaled_national_environment_adjustment_dem,independent_candidate_present,independent_candidate_name,independent_candidate_party_lean,independent_vote_share_estimate,independent_asymmetry_adjustment_dem,independent_adjustment_rationale,dem_previous_statewide_winner,gop_previous_statewide_winner,previous_statewide_winner_notes,candidate_scandal_adjustment_dem,candidate_scandal_rationale,candidate_war_adjustment_dem,statewide_win_bonus_dem,mechanical_candidate_adjustment_dem,candidate_quality_method,candidate_quality_framework_version,bayesian_polling_weight,bayesian_polling_weight_capped,bayesian_prior_weight,bayesian_fundamentals_weight_capped,bayesian_model_margin_dem,bayesian_model_margin_dem_capped,posterior_margin_dem,posterior_margin_dem_capped,polling_confidence_boost,polling_confidence_absolute_cap,polling_confidence_weight_change,polling_confidence_margin_change_dem,recent_poll_count_45d,most_recent_poll_end_date,bayesian_polling_weight_capped_before_polling_confidence_accelerator,bayesian_polling_weight_capped_after_polling_confidence_accelerator,bayesian_model_margin_dem_capped_before_polling_confidence_accelerator
GA,Jon Ossoff,Mike Collins,D,0.9068288682603954,7.216007575757574,1.1,0.9,1,Competitive,Democratic-held; GOP runoff after May 2026 primary.,1.0,True,2026-05-23,2.0,2026-05-11,15.080729907171778,plurality,False,,,,,,,-2.2,0.24,-5.1,-2.025,6.584999999999999,5.926499999999999,2.0,1.3145075757575757,0.0,GA: Ossoff Democratic incumbent adjustment.,8.0,7.216007575757574,D,presidential_weighted,True,True,True,True,True,False,0.0,0.0,0.0,0.0,0.0,1.0,0.0,0.0,1.0,Full candidate-quality effect because both nominees are confirmed. Manual CQ input: +0.00. Objective CQ before gate: +1.00. Dem has prior elected-office experience. GOP has prior elected-office experience. Dem has prior statewide win. Final candidate-quality adjustment: +1.00. Liability scale: 0=no known liability; 0.5=mild weakness; 1.0=clear electoral weakness; 1.5=major documented liability; 2.0=severe nominee-quality problem. Dem liability hurts Democrats; GOP liability helps Democrats.,0.0,1.3145075757575757,,,0.9068288682603954,0.5694294940796555,0.55,0.18,0.0,7.216007575757574,,,,,,,,6.397499999999999,6.397499999999999,False,,none,0.0,0.0,,True,False,Jon Ossoff previously won statewide Senate election in Georgia.,0.0,,0.5645075757575757,0.75,1.3145075757575757,"Framework v3 / Option B: mechanical_candidate_adjustment_dem = candidate_war_adjustment_dem + statewide_win_bonus_dem, capped at +/-1.5; candidate_scandal_adjustment_dem manual, capped at +/-3.0; final candidate_quality_adjustment_dem capped at +/-4.0.",senate_candidate_quality_framework_v3_option_b,0.099,0.099,0.901,0.901,6.591398883715354,6.591398883715354,6.591398883715354,6.591398883715354,0.0,0.3,0.0,0.0,0,,0.099,0.099,6.591398883715354
MI,Democratic nominee TBD,Republican nominee TBD,D-open,2.0,6.744249999999999,1.05,1.05,1,Competitive,Open Democratic-held seat; Gary Peters retiring.,1.0,False,2026-05-23,0.0,,,plurality,False,,,,,,,-1.4,2.8,-0.2,-0.17,6.584999999999999,6.914249999999999,0.0,0.0,0.0,"Calculated from 2024/2020/2016 presidential margins (60%/25%/15%), state elasticity, national environment, incumbency, candidate quality, and special adjustments.",8.0,6.744249999999999,OPEN,presidential_weighted,False,False,False,False,False,False,0.0,0.0,0.0,0.0,0.0,0.0,0.0,0.0,1.0,No candidate-quality effect because nominees are not confirmed. Manual CQ input: +0.00. Objective CQ before gate: +0.00. Final candidate-quality adjustment: +0.00. Liability scale: 0=no known liability; 0.5=mild weakness; 1.0=clear electoral weakness; 1.5=major documented liability; 2.0=severe nominee-quality problem. Dem liability hurts Democrats; GOP liability helps Democrats.,0.0,0.0,,,2.0,0.4584055459272096,0.0,0.18,0.0,6.744249999999999,,,,,,,,7.463749999999999,7.463749999999999,False,,none,0.0,0.0,,False,False,,0.0,,0.0,0.0,0.0,"Framework v3 / Option B: mechanical_candidate_adjustment_dem = candidate_war_adjustment_dem + statewide_win_bonus_dem, capped at +/-1.5; candidate_scandal_adjustment_dem manual, capped at +/-3.0; final candidate_quality_adjustment_dem capped at +/-4.0.",senate_candidate_quality_framework_v3_option_b,0.0,0.0,1.0,1.0,6.744249999999999,6.744249999999999,6.744249999999999,6.744249999999999,0.0,0.3,0.0,0.0,0,,0.0,0.0,6.744249999999999
MN,Peggy Flanagan / Angie Craig primary,Michele Tafoya / Royce White / Tom Weiler / Adam Schwarze primary,D-open,6.0,11.2565,0.9,0.9,1,Likely,Open Democratic-held seat; Tina Smith retiring.,0.85,False,2026-05-23,0.0,,,plurality,False,,,,,,,4.3,7.1,1.5,4.579999999999999,6.584999999999999,5.926499999999999,0.0,0.75,0.0,"Calculated from 2024/2020/2016 presidential margins (60%/25%/15%), state elasticity, national environment, incumbency, candidate quality, and special adjustments.",8.0,11.2565,OPEN,presidential_weighted,False,False,False,False,False,False,0.0,0.0,0.0,0.0,0.0,0.0,0.0,0.0,1.0,No candidate-quality effect because nominees are not confirmed. Manual CQ input: +0.00. Objective CQ before gate: +0.00. Final candidate-quality adjustment: +0.00. Liability scale: 0=no known liability; 0.5=mild weakness; 1.0=clear electoral weakness; 1.5=major documented liability; 2.0=severe nominee-quality problem. Dem liability hurts Democrats; GOP liability helps Democrats.,0.0,0.75,,,6.0,0.4584055459272096,0.0,0.18,0.0,11.2565,,,,,,,,6.397499999999999,6.397499999999999,False,,none,0.0,0.0,,True,False,Peggy Flanagan has previously won statewide lieutenant governor elections if she is nominee; primary still unresolved.,0.0,,0.0,0.75,0.75,"Framework v3 / Option B: mechanical_candidate_adjustment_dem = candidate_war_adjustment_dem + statewide_win_bonus_dem, capped at +/-1.5; candidate_scandal_adjustment_dem manual, capped at +/-3.0; final candidate_quality_adjustment_dem capped at +/-4.0.",senate_candidate_quality_framework_v3_option_b,0.0,0.0,1.0,1.0,11.2565,11.2565,11.2565,11.2565,0.0,0.3,0.0,0.0,0,,0.0,0.0,11.2565
NH,Chris Pappas / Karishma Manzur / Jared Sullivan primary,Scott Brown / John E. Sununu / Daniel Innis primary,D-open,3.0,10.444249999999998,1.05,1.05,1,Competitive,Open Democratic-held seat; Shaheen retiring.,1.0,False,2026-05-23,0.0,,,plurality,False,,,,,,,2.7,7.4,0.4,3.53,6.584999999999999,6.914249999999999,0.0,0.0,0.0,"Calculated from 2024/2020/2016 presidential margins (60%/25%/15%), state elasticity, national environment, incumbency, candidate quality, and special adjustments.",8.0,10.444249999999998,OPEN,presidential_weighted,False,False,False,False,False,False,0.0,0.0,0.0,0.0,0.0,0.0,0.0,0.0,1.0,No candidate-quality effect because nominees are not confirmed. Manual CQ input: +0.00. Objective CQ before gate: +0.00. Final candidate-quality adjustment: +0.00. Liability scale: 0=no known liability; 0.5=mild weakness; 1.0=clear electoral weakness; 1.5=major documented liability; 2.0=severe nominee-quality problem. Dem liability hurts Democrats; GOP liability helps Democrats.,0.0,0.0,,,3.0,0.4584055459272096,0.0,0.18,0.0,10.444249999999998,,,,,,,,7.463749999999999,7.463749999999999,False,,none,0.0,0.0,,False,False,,0.0,,0.0,0.0,0.0,"Framework v3 / Option B: mechanical_candidate_adjustment_dem = candidate_war_adjustment_dem + statewide_win_bonus_dem, capped at +/-1.5; candidate_scandal_adjustment_dem manual, capped at +/-3.0; final candidate_quality_adjustment_dem capped at +/-4.0.",senate_candidate_quality_framework_v3_option_b,0.0,0.0,1.0,1.0,10.444249999999998,10.444249999999998,10.444249999999998,10.444249999999998,0.0,0.3,0.0,0.0,0,,0.0,0.0,10.444249999999998
NC,Roy Cooper,Michael Whatley,R-open,4.55,3.875499999999999,1.05,0.9,1,Competitive,Open Republican-held seat; Tillis retiring; Cooper and Whatley are major candidates.,1.0,True,2026-05-23,1.0,2026-05-08,52.0,plurality,False,,,,,,,-3.21,-1.34,-3.6,-2.801,6.584999999999999,5.926499999999999,0.0,0.75,0.0,NC: Cooper candidate-strength placeholder; no Senate incumbency adjustment.,8.0,3.875499999999999,OPEN,presidential_weighted,True,True,True,False,True,False,5.5,0.0,0.0,0.0,0.5,1.0,0.0,0.0,1.0,Full candidate-quality effect because both nominees are confirmed. Manual CQ input: +0.00. Objective CQ before gate: +2.88. Dem has prior elected-office experience. Dem has prior statewide win. Dem prior overperformance: +5.5. Final candidate-quality adjustment: +2.88. Liability scale: 0=no known liability; 0.5=mild weakness; 1.0=clear electoral weakness; 1.5=major documented liability; 2.0=severe nominee-quality problem. Dem liability hurts Democrats; GOP liability helps Democrats.,0.0,0.75,,10.695620799334874,4.55,0.900547822649971,0.3,0.18,2.0,3.875499999999999,,,,,,,,6.397499999999999,6.397499999999999,False,,none,0.0,0.0,,True,False,Roy Cooper previously won statewide gubernatorial elections in North Carolina.,0.0,,0.0,0.75,0.75,"Framework v3 / Option B: mechanical_candidate_adjustment_dem = candidate_war_adjustment_dem + statewide_win_bonus_dem, capped at +/-1.5; candidate_scandal_adjustment_dem manual, capped at +/-3.0; final candidate_quality_adjustment_dem capped at +/-4.0.",senate_candidate_quality_framework_v3_option_b,0.054,0.054,0.946,0.946,3.9119229999999985,3.9119229999999985,3.9119229999999985,3.9119229999999985,0.0,0.3,0.0,0.0,0,,0.054,0.054,3.9119229999999985
ME,Graham Platner,Susan Collins,R,3.749587211836593,6.805249999999997,1.15,0.75,1,Competitive,Republican-held; Collins running; Democratic field includes Platner and Costello.,1.0,True,2026-05-23,10.0,2026-06-16,29.7,rcv,True,,,,,,,6.94,9.07,2.9,6.866499999999999,6.584999999999999,4.938749999999999,-2.5,-2.5,0.0,ME: Collins Republican incumbent / overperformance adjustment.,8.75,6.805249999999997,R,presidential_weighted,True,True,False,True,False,True,0.0,8.0,1.0,0.0,-0.5,-1.0,0.0,0.0,1.0,Full candidate-quality effect because both nominees are confirmed. Manual CQ input: +0.00. Objective CQ before gate: -4.00. GOP has prior elected-office experience. GOP has prior statewide win. GOP prior overperformance: +8.0. Dem liability: 1.0. Final candidate-quality adjustment: -4.00. Liability scale: 0=no known liability; 0.5=mild weakness; 1.0=clear electoral weakness; 1.5=major documented liability; 2.0=severe nominee-quality problem. Dem liability hurts Democrats; GOP liability helps Democrats.,0.0,-2.5,ME D liability updated to 1.00: Sexting,140.35806190422932,3.749587211836593,0.900547822649971,1.0,0.18,0.0,6.805249999999997,Intentional exceptional-case adjustment. Susan Collins has a long record of crossover overperformance in Maine; generic incumbency is retained but should be reviewed alongside overperformance and candidate-quality adjustments.,Intentional exceptional-case adjustment. Collins' long record of overperformance combined with Graham Platner's scandal/liability creates an unusually asymmetric candidate-quality environment. Aggressive adjustment is intentional but should be revisited after credible Maine polling.,"Collins has historically overperformed Maine's partisan baseline by a meaningful margin. Kept as a separate adjustment because this race is unusually candidate-specific, but double-counting risk should be monitored.",Platner scandal/liability is treated as a real candidate-specific drag. Reassess if future polling shows the issue has faded or is already fully reflected in topline polling.,,2026-06-09,Reviewed - intentional exception,5.331249999999999,5.331249999999999,True,,none,0.0,0.0,Maine is flagged for human review because independent/non-major-party dynamics can materially affect major-party margins.,False,True,Susan Collins previously won statewide Senate elections in Maine.,-1.0,"Explicit candidate-liability adjustment for Graham Platner. Set at -1.0 rather than -2.0 because Maine now has a dense recent polling record, so some liability/scandal effect is likely reflected in the polling layer. Reassess as additional credible Maine polling accumulates.",-0.75,-0.75,-1.5,"Framework v3 / Option B: mechanical_candidate_adjustment_dem = candidate_war_adjustment_dem + statewide_win_bonus_dem, capped at +/-1.5; candidate_scandal_adjustment_dem manual, capped at +/-3.0; final candidate_quality_adjustment_dem capped at +/-4.0.",senate_candidate_quality_framework_v3_option_b,0.27,0.27,0.73,0.73,5.9802210471958785,5.9802210471958785,5.9802210471958785,5.9802210471958785,0.09,0.3,0.09000000000000002,-0.27500965093470686,10,2026-06-16,0.18,0.27,6.255230698130585
TX,James Talarico,Ken Paxton,R,0.8520669353988768,-6.0142500000000005,0.75,0.75,1,Likely,Republican-held; Talarico won Democratic primary; Cornyn and Paxton in May 26 GOP runoff.,0.85,True,2026-05-23,6.0,2026-06-12,25.666666666666668,plurality,False,,,,,,,-13.68,-5.58,-9.0,-10.953,6.584999999999999,4.938749999999999,0.0,0.0,0.0,TX: no direct Senate incumbency boost; modest Democratic candidate-quality placeholder.,8.0,-6.0142500000000005,R,presidential_weighted,True,True,True,True,False,True,0.0,-2.0,0.0,1.0,0.0,-1.0,0.0,0.0,1.0,Full candidate-quality effect because both nominees are confirmed. Manual CQ input: +0.00. Objective CQ before gate: +0.50. Dem has prior elected-office experience. GOP has prior elected-office experience. GOP has prior statewide win. GOP prior overperformance: -2.0. GOP liability: 1.0. Final candidate-quality adjustment: +0.50. Liability scale: 0=no known liability; 0.5=mild weakness; 1.0=clear electoral weakness; 1.5=major documented liability; 2.0=severe nominee-quality problem. Dem liability hurts Democrats; GOP liability helps Democrats.,0.0,0.0,,97.8728552696928,0.8520669353988768,0.900547822649971,1.0,0.18,1.0,-6.0142500000000005,,,,,,,,5.331249999999999,5.331249999999999,False,,none,0.0,0.0,,False,False,,0.0,,0.0,0.0,0.0,"Framework v3 / Option B: mechanical_candidate_adjustment_dem = candidate_war_adjustment_dem + statewide_win_bonus_dem, capped at +/-1.5; candidate_scandal_adjustment_dem manual, capped at +/-3.0; final candidate_quality_adjustment_dem capped at +/-4.0.",senate_candidate_quality_framework_v3_option_b,0.27,0.27,0.73,0.73,-4.160344427442304,-4.160344427442304,-4.160344427442304,-4.160344427442304,0.09,0.3,0.09000000000000002,0.6179685241858985,6,2026-06-12,0.18,0.27,-4.778312951628203
OH,Sherrod Brown,Jon Husted,R-appointed,4.067161451447854,-5.064625,0.8,0.75,1,Competitive,Special election; Husted appointed/incumbent; Brown Democratic nominee.,1.0,True,2026-05-23,3.0,2026-06-16,18.333333333333332,plurality,False,,,,,,,-11.21,-8.03,-8.1,-9.9485,6.584999999999999,4.938749999999999,-1.0,0.945125,0.0,OH: appointed GOP incumbent placeholder plus Brown candidate-strength placeholder.,8.0,-5.064625,R-APPOINTED,presidential_weighted,True,True,True,True,True,True,5.0,0.0,0.0,0.0,0.0,0.0,0.0,0.0,1.0,Full candidate-quality effect because both nominees are confirmed. Manual CQ input: +0.00. Objective CQ before gate: +1.25. Dem has prior elected-office experience. GOP has prior elected-office experience. Dem has prior statewide win. GOP has prior statewide win. Dem prior overperformance: +5.0. Final candidate-quality adjustment: +1.25. Liability scale: 0=no known liability; 0.5=mild weakness; 1.0=clear electoral weakness; 1.5=major documented liability; 2.0=severe nominee-quality problem. Dem liability hurts Democrats; GOP liability helps Democrats.,0.0,0.945125,,50.36121859719151,4.067161451447854,0.900547822649971,0.75,0.18,2.0,-5.064625,,,,,,,,5.331249999999999,5.331249999999999,False,,none,0.0,0.0,,True,False,Sherrod Brown previously won statewide Senate elections in Ohio.,0.0,,0.1951249999999999,0.75,0.945125,"Framework v3 / Option B: mechanical_candidate_adjustment_dem = candidate_war_adjustment_dem + statewide_win_bonus_dem, capped at +/-1.5; candidate_scandal_adjustment_dem manual, capped at +/-3.0; final candidate_quality_adjustment_dem capped at +/-4.0.",senate_candidate_quality_framework_v3_option_b,0.195,0.195,0.8049999999999999,0.8049999999999999,-3.2839266419676685,-3.2839266419676685,-3.2839266419676685,-3.2839266419676685,0.06,0.3,0.06,0.5479071870868717,3,2026-06-16,0.135,0.195,-3.83183382905454
FL,Angie Nixon / Alex Vindman primary,Ashley Moody,R-appointed,-2.1568141792341136,-5.2705,0.7,0.7,1,Likely,Special election; Moody appointed/incumbent; Democratic field includes Nixon and Vindman.,0.85,True,2026-05-23,5.0,2026-06-14,31.0,plurality,False,,,,,,,-13.1,-3.36,-1.2,-8.879999999999999,6.584999999999999,4.609499999999999,-1.0,0.0,0.0,FL: appointed Republican incumbent adjustment.,8.0,-5.2705,R-APPOINTED,presidential_weighted,False,False,False,False,False,False,0.0,0.0,0.0,0.0,0.0,0.0,0.0,0.0,1.0,No candidate-quality effect because nominees are not confirmed. Manual CQ input: +0.00. Objective CQ before gate: +0.00. Final candidate-quality adjustment: +0.00. Liability scale: 0=no known liability; 0.5=mild weakness; 1.0=clear electoral weakness; 1.5=major documented liability; 2.0=severe nominee-quality problem. Dem liability hurts Democrats; GOP liability helps Democrats.,0.0,0.0,,76.82221829559539,-2.1568141792341136,0.900547822649971,1.0,0.18,0.0,-5.2705,,,,,,,,4.975833333333332,4.975833333333332,False,,none,0.0,0.0,,False,False,,0.0,,0.0,0.0,0.0,"Framework v3 / Option B: mechanical_candidate_adjustment_dem = candidate_war_adjustment_dem + statewide_win_bonus_dem, capped at +/-1.5; candidate_scandal_adjustment_dem manual, capped at +/-3.0; final candidate_quality_adjustment_dem capped at +/-4.0.",senate_candidate_quality_framework_v3_option_b,0.27,0.27,0.73,0.73,-4.429804828393211,-4.429804828393211,-4.429804828393211,-4.429804828393211,0.09,0.3,0.09000000000000002,0.2802317238689298,5,2026-06-14,0.18,0.27,-4.710036552262141
IA,Josh Turek,Ashley Hinson,R-open,-0.4925567088758245,-6.52157774390244,0.75,0.75,1,Likely,Open Republican-held seat; Joni Ernst not seeking reelection per current race summaries.,0.85,True,2026-05-23,3.0,2026-06-19,16.333333333333332,plurality,False,,,,,,,-13.3,-8.2,-9.4,-11.44,6.584999999999999,4.938749999999999,0.0,-0.020327743902439,0.0,"Calculated from 2024/2020/2016 presidential margins (60%/25%/15%), state elasticity, national environment, incumbency, candidate quality, and special adjustments.",8.0,-6.52157774390244,OPEN,presidential_weighted,True,True,True,True,False,False,0.0,0.0,0.0,0.0,0.0,0.0,0.0,0.0,1.0,Full candidate-quality effect because both nominees are confirmed. Manual CQ input: +0.00. Objective CQ before gate: +0.00. Dem has prior elected-office experience. GOP has prior elected-office experience. Final candidate-quality adjustment: +0.00. Liability scale: 0=no known liability; 0.5=mild weakness; 1.0=clear electoral weakness; 1.5=major documented liability; 2.0=severe nominee-quality problem. Dem liability hurts Democrats; GOP liability helps Democrats.,0.0,-0.020327743902439,,50.26068461536573,-0.4925567088758245,0.900547822649971,0.75,0.18,0.0,-6.52157774390244,,,,,,,,5.331249999999999,5.331249999999999,False,,none,0.0,0.0,,False,False,,0.0,,-0.020327743902439,0.0,-0.020327743902439,"Framework v3 / Option B: mechanical_candidate_adjustment_dem = candidate_war_adjustment_dem + statewide_win_bonus_dem, capped at +/-1.5; candidate_scandal_adjustment_dem manual, capped at +/-3.0; final candidate_quality_adjustment_dem capped at +/-4.0.",senate_candidate_quality_framework_v3_option_b,0.195,0.195,0.8049999999999999,0.8049999999999999,-5.34591864207225,-5.34591864207225,-5.34591864207225,-5.34591864207225,0.06,0.3,0.06,0.36174126210159674,3,2026-06-19,0.135,0.195,-5.7076599041738465
AK,Mary Peltola,Dan Sullivan,R,4.90969795628966,-8.38257196969697,0.65,0.65,1,Likely,Republican-held; Sullivan incumbent; Democratic/independent field may include Mary Peltola.,0.85,True,2026-05-23,2.0,2026-06-07,31.5,top4_rcv,True,,,,,,,-13.13,-10.06,-14.7,-12.598,6.584999999999999,4.28025,-1.5,1.4351780303030304,0.0,AK: GOP incumbent adjustment partly offset by Democratic crossover/candidate-strength placeholder.,8.75,-8.38257196969697,R,presidential_weighted,False,False,True,True,True,True,8.0,0.0,0.0,0.0,0.0,0.0,0.0,0.0,1.0,No candidate-quality effect because nominees are not confirmed. Manual CQ input: +0.00. Objective CQ before gate: +2.00. Dem has prior elected-office experience. GOP has prior elected-office experience. Dem has prior statewide win. GOP has prior statewide win. Dem prior overperformance: +8.0. Final candidate-quality adjustment: +0.00. Liability scale: 0=no known liability; 0.5=mild weakness; 1.0=clear electoral weakness; 1.5=major documented liability; 2.0=severe nominee-quality problem. Dem liability hurts Democrats; GOP liability helps Democrats.,0.0,1.4351780303030304,,30.621932042514903,4.90969795628966,0.900547822649971,0.55,0.18,1.0,-8.38257196969697,,,,,,,,4.620416666666666,4.620416666666666,False,,none,0.0,0.0,,True,False,Mary Peltola previously won statewide U.S. House elections in Alaska.,0.0,,0.6851780303030304,0.75,1.4351780303030304,"Framework v3 / Option B: mechanical_candidate_adjustment_dem = candidate_war_adjustment_dem + statewide_win_bonus_dem, capped at +/-1.5; candidate_scandal_adjustment_dem manual, capped at +/-3.0; final candidate_quality_adjustment_dem capped at +/-4.0.",senate_candidate_quality_framework_v3_option_b,0.129,0.129,0.871,0.871,-6.667869149244694,-6.667869149244694,-6.667869149244694,-6.667869149244694,0.03,0.3,0.03,0.3987680977796,2,2026-06-07,0.099,0.129,-7.066637247024294
CO,John Hickenlooper,Republican nominee TBD,D,9.0,19.09225,0.85,0.85,1,Safe,Democratic-held,0.65,False,2026-05-23,0.0,,,plurality,False,,,,,,,11.0,13.5,4.9,10.71,6.584999999999999,5.597249999999999,2.0,0.785,0.0,"Calculated from 2024/2020/2016 presidential margins (60%/25%/15%), state elasticity, national environment, incumbency, candidate quality, and special adjustments.",8.0,19.09225,D,presidential_weighted,False,False,False,False,False,False,0.0,0.0,0.0,0.0,0.0,0.0,0.0,0.0,1.0,No candidate-quality effect because nominees are not confirmed. Manual CQ input: +0.00. Objective CQ before gate: +0.00. Final candidate-quality adjustment: +0.00. Liability scale: 0=no known liability; 0.5=mild weakness; 1.0=clear electoral weakness; 1.5=major documented liability; 2.0=severe nominee-quality problem. Dem liability hurts Democrats; GOP liability helps Democrats.,0.0,0.785,,,9.0,0.4584055459272096,0.0,0.18,0.0,19.09225,,,,,,,,6.042083333333332,6.042083333333332,False,,none,0.0,0.0,,True,False,John Hickenlooper previously won statewide elections in Colorado.,0.0,,0.035,0.75,0.785,"Framework v3 / Option B: mechanical_candidate_adjustment_dem = candidate_war_adjustment_dem + statewide_win_bonus_dem, capped at +/-1.5; candidate_scandal_adjustment_dem manual, capped at +/-3.0; final candidate_quality_adjustment_dem capped at +/-4.0.",senate_candidate_quality_framework_v3_option_b,0.0,0.0,1.0,1.0,19.09225,19.09225,19.09225,19.09225,0.0,0.3,0.0,0.0,0,,0.0,0.0,19.09225
DE,Chris Coons,Republican nominee TBD,D,15.0,23.016,0.75,0.75,1,Safe,Democratic-held,0.65,False,2026-05-23,0.0,,,plurality,False,,,,,,,14.7,19.0,11.4,15.279999999999998,6.584999999999999,4.938749999999999,2.0,0.79725,0.0,"Calculated from 2024/2020/2016 presidential margins (60%/25%/15%), state elasticity, national environment, incumbency, candidate quality, and special adjustments.",8.0,23.016,D,presidential_weighted,False,False,False,False,False,False,0.0,0.0,0.0,0.0,0.0,0.0,0.0,0.0,1.0,No candidate-quality effect because nominees are not confirmed. Manual CQ input: +0.00. Objective CQ before gate: +0.00. Final candidate-quality adjustment: +0.00. Liability scale: 0=no known liability; 0.5=mild weakness; 1.0=clear electoral weakness; 1.5=major documented liability; 2.0=severe nominee-quality problem. Dem liability hurts Democrats; GOP liability helps Democrats.,0.0,0.79725,,,15.0,0.4584055459272096,0.0,0.18,0.0,23.016,,,,,,,,5.331249999999999,5.331249999999999,False,,none,0.0,0.0,,True,False,Chris Coons previously won statewide Senate elections in Delaware.,0.0,,0.04725,0.75,0.79725,"Framework v3 / Option B: mechanical_candidate_adjustment_dem = candidate_war_adjustment_dem + statewide_win_bonus_dem, capped at +/-1.5; candidate_scandal_adjustment_dem manual, capped at +/-3.0; final candidate_quality_adjustment_dem capped at +/-4.0.",senate_candidate_quality_framework_v3_option_b,0.0,0.0,1.0,1.0,23.016,23.016,23.016,23.016,0.0,0.3,0.0,0.0,0,,0.0,0.0,23.016
