OK,Troy Green / Jim Priest / N'Kiyla Thomas primary,Kevin Hern / William Buckner / Gary Ty England / GOP primary,R-open,-30.0,-31.35175,0.45,0.45,1,UltraSafe,Open Republican-held seat per current race summaries.,0.45,False,2026-05-23,0.0,,,plurality,False,,,,,,,-34.3,-33.1,-36.4,-34.315,6.584999999999999,2.9632499999999995,0.0,0.0,0.0,"Calculated from 2024/2020/2016 presidential margins (60%/25%/15%), state elasticity, national environment, incumbency, candidate quality, and special adjustments.",8.0,-31.35175,OPEN,presidential_weighted,False,False,False,False,False,False,0.0,0.0,0.0,0.0,0.0,0.0,0.0,0.0,1.0,No candidate-quality effect because nominees are not confirmed. Manual CQ input: +0.00. Objective CQ before gate: +0.00. Final candidate-quality adjustment: +0.00. Liability scale: 0=no known liability; 0.5=mild weakness; 1.0=clear electoral weakness; 1.5=major documented liability; 2.0=severe nominee-quality problem. Dem liability hurts Democrats; GOP liability helps Democrats.,0.0,0.0,,,-30.0,0.4584055459272096,0.0,0.18,0.0,-31.35175,,,,,,,,3.1987499999999995,3.1987499999999995,False,,none,0.0,0.0,,False,False,,0.0,,0.0,0.0,0.0,"Framework v3 / Option B: mechanical_candidate_adjustment_dem = candidate_war_adjustment_dem + statewide_win_bonus_dem, capped at +/-1.5; candidate_scandal_adjustment_dem manual, capped at +/-3.0; final candidate_quality_adjustment_dem capped at +/-4.0.",senate_candidate_quality_framework_v3_option_b,0.0,0.0,1.0,1.0,-31.35175,-31.35175,-31.35175,-31.35175,0.0,0.3,0.0,0.0,0,,0.0,0.0,-31.35175
SC,Annie Andrews,Lindsay Graham,R,-12.0,-13.039875000000002,0.7,0.7,1,Safe,Republican-held; Graham incumbent running.,0.65,False,2026-05-23,0.0,,,plurality,False,,,,,,,-17.8,-11.7,-14.3,-15.75,6.584999999999999,4.609499999999999,-2.0,0.1006249999999999,0.0,"Calculated from 2024/2020/2016 presidential margins (60%/25%/15%), state elasticity, national environment, incumbency, candidate quality, and special adjustments.",8.0,-13.039875000000002,R,presidential_weighted,False,False,False,False,False,False,0.0,0.0,0.0,0.0,0.0,0.0,0.0,0.0,1.0,No candidate-quality effect because nominees are not confirmed. Manual CQ input: +0.00. Objective CQ before gate: +0.00. Final candidate-quality adjustment: +0.00. Liability scale: 0=no known liability; 0.5=mild weakness; 1.0=clear electoral weakness; 1.5=major documented liability; 2.0=severe nominee-quality problem. Dem liability hurts Democrats; GOP liability helps Democrats.,0.0,0.1006249999999999,,,-12.0,0.4584055459272096,0.0,0.18,0.0,-13.039875000000002,,,,,,,,4.975833333333332,4.975833333333332,False,,none,0.0,0.0,,False,False,,0.0,,0.1006249999999999,0.0,0.1006249999999999,"Framework v3 / Option B: mechanical_candidate_adjustment_dem = candidate_war_adjustment_dem + statewide_win_bonus_dem, capped at +/-1.5; candidate_scandal_adjustment_dem manual, capped at +/-3.0; final candidate_quality_adjustment_dem capped at +/-4.0.",senate_candidate_quality_framework_v3_option_b,0.0,0.0,1.0,1.0,-13.039875000000002,-13.039875000000002,-13.039875000000002,-13.039875000000002,0.0,0.3,0.0,0.0,0,,0.0,0.0,-13.039875000000002
SD,Julian Beaudion,Mike Rounds,R,-25.0,-27.9625,0.5,0.5,1,UltraSafe,Republican-held,0.45,False,2026-05-23,0.0,,,plurality,False,,,,,,,-29.2,-26.2,-29.8,-28.54,6.584999999999999,3.2924999999999995,-2.0,-0.7150000000000001,0.0,"Calculated from 2024/2020/2016 presidential margins (60%/25%/15%), state elasticity, national environment, incumbency, candidate quality, and special adjustments.",8.0,-27.9625,R,presidential_weighted,False,False,False,False,False,False,0.0,0.0,0.0,0.0,0.0,0.0,0.0,0.0,1.0,No candidate-quality effect because nominees are not confirmed. Manual CQ input: +0.00. Objective CQ before gate: +0.00. Final candidate-quality adjustment: +0.00. Liability scale: 0=no known liability; 0.5=mild weakness; 1.0=clear electoral weakness; 1.5=major documented liability; 2.0=severe nominee-quality problem. Dem liability hurts Democrats; GOP liability helps Democrats.,0.0,-0.7150000000000001,,,-25.0,0.4584055459272096,0.0,0.18,0.0,-27.9625,,,,,,,,3.5541666666666663,3.5541666666666663,False,,none,0.0,0.0,,False,True,Mike Rounds previously won statewide Senate and gubernatorial elections in South Dakota.,0.0,,0.0349999999999999,-0.75,-0.7150000000000001,"Framework v3 / Option B: mechanical_candidate_adjustment_dem = candidate_war_adjustment_dem + statewide_win_bonus_dem, capped at +/-1.5; candidate_scandal_adjustment_dem manual, capped at +/-3.0; final candidate_quality_adjustment_dem capped at +/-4.0.",senate_candidate_quality_framework_v3_option_b,0.0,0.0,1.0,1.0,-27.9625,-27.9625,-27.9625,-27.9625,0.0,0.3,0.0,0.0,0,,0.0,0.0,-27.9625
TN,Democratic nominee TBD,Bill Hagerty,R,-22.0,-26.696375,0.55,0.55,1,UltraSafe,Republican-held,0.45,False,2026-05-23,0.0,,,plurality,False,,,,,,,-29.7,-23.2,-26.0,-27.52,6.584999999999999,3.62175,-2.0,-0.798125,0.0,"Calculated from 2024/2020/2016 presidential margins (60%/25%/15%), state elasticity, national environment, incumbency, candidate quality, and special adjustments.",8.0,-26.696375,R,presidential_weighted,False,False,False,False,False,False,0.0,0.0,0.0,0.0,0.0,0.0,0.0,0.0,1.0,No candidate-quality effect because nominees are not confirmed. Manual CQ input: +0.00. Objective CQ before gate: +0.00. Final candidate-quality adjustment: +0.00. Liability scale: 0=no known liability; 0.5=mild weakness; 1.0=clear electoral weakness; 1.5=major documented liability; 2.0=severe nominee-quality problem. Dem liability hurts Democrats; GOP liability helps Democrats.,0.0,-0.798125,,,-22.0,0.4584055459272096,0.0,0.18,0.0,-26.696375,,,,,,,,3.9095833333333334,3.9095833333333334,False,,none,0.0,0.0,,False,True,Bill Hagerty previously won statewide Senate election in Tennessee.,0.0,,-0.048125,-0.75,-0.798125,"Framework v3 / Option B: mechanical_candidate_adjustment_dem = candidate_war_adjustment_dem + statewide_win_bonus_dem, capped at +/-1.5; candidate_scandal_adjustment_dem manual, capped at +/-3.0; final candidate_quality_adjustment_dem capped at +/-4.0.",senate_candidate_quality_framework_v3_option_b,0.0,0.0,1.0,1.0,-26.696375,-26.696375,-26.696375,-26.696375,0.0,0.3,0.0,0.0,0,,0.0,0.0,-26.696375
WV,Rachel Anderson,Shelley Moore Capito,R,-30.0,-41.071749999999994,0.45,0.45,1,UltraSafe,Republican-held,0.45,False,2026-05-23,0.0,,,plurality,False,,,,,,,-42.0,-38.9,-41.7,-41.18,6.584999999999999,2.9632499999999995,-2.0,-0.855,0.0,"Calculated from 2024/2020/2016 presidential margins (60%/25%/15%), state elasticity, national environment, incumbency, candidate quality, and special adjustments.",8.0,-41.071749999999994,R,presidential_weighted,False,False,False,False,False,False,0.0,0.0,0.0,0.0,0.0,0.0,0.0,0.0,1.0,No candidate-quality effect because nominees are not confirmed. Manual CQ input: +0.00. Objective CQ before gate: +0.00. Final candidate-quality adjustment: +0.00. Liability scale: 0=no known liability; 0.5=mild weakness; 1.0=clear electoral weakness; 1.5=major documented liability; 2.0=severe nominee-quality problem. Dem liability hurts Democrats; GOP liability helps Democrats.,0.0,-0.855,,,-30.0,0.4584055459272096,0.0,0.18,0.0,-41.071749999999994,,,,,,,,3.1987499999999995,3.1987499999999995,False,,none,0.0,0.0,,False,True,Shelley Moore Capito previously won statewide Senate elections in West Virginia.,0.0,,-0.105,-0.75,-0.855,"Framework v3 / Option B: mechanical_candidate_adjustment_dem = candidate_war_adjustment_dem + statewide_win_bonus_dem, capped at +/-1.5; candidate_scandal_adjustment_dem manual, capped at +/-3.0; final candidate_quality_adjustment_dem capped at +/-4.0.",senate_candidate_quality_framework_v3_option_b,0.0,0.0,1.0,1.0,-41.071749999999994,-41.071749999999994,-41.071749999999994,-41.071749999999994,0.0,0.3,0.0,0.0,0,,0.0,0.0,-41.071749999999994
WY,James W. Byrd,Harriet Hageman / Sam Mead / Jimmy Skovgard primary,R-open,-35.0,-42.101,0.4,0.4,1,UltraSafe,Open Republican-held seat per current summaries.,0.45,False,2026-05-23,0.0,,,plurality,False,,,,,,,-44.9,-43.4,-46.3,-44.735,6.584999999999999,2.634,0.0,0.0,0.0,"Calculated from 2024/2020/2016 presidential margins (60%/25%/15%), state elasticity, national environment, incumbency, candidate quality, and special adjustments.",8.0,-42.101,OPEN,presidential_weighted,False,False,False,False,False,False,0.0,0.0,0.0,0.0,0.0,0.0,0.0,0.0,1.0,No candidate-quality effect because nominees are not confirmed. Manual CQ input: +0.00. Objective CQ before gate: +0.00. Final candidate-quality adjustment: +0.00. Liability scale: 0=no known liability; 0.5=mild weakness; 1.0=clear electoral weakness; 1.5=major documented liability; 2.0=severe nominee-quality problem. Dem liability hurts Democrats; GOP liability helps Democrats.,0.0,0.0,,,-35.0,0.4584055459272096,0.0,0.18,0.0,-42.101,,,,,,,,2.8433333333333333,2.8433333333333333,False,,none,0.0,0.0,,False,False,,0.0,,0.0,0.0,0.0,"Framework v3 / Option B: mechanical_candidate_adjustment_dem = candidate_war_adjustment_dem + statewide_win_bonus_dem, capped at +/-1.5; candidate_scandal_adjustment_dem manual, capped at +/-3.0; final candidate_quality_adjustment_dem capped at +/-4.0.",senate_candidate_quality_framework_v3_option_b,0.0,0.0,1.0,1.0,-42.101,-42.101,-42.101,-42.101,0.0,0.3,0.0,0.0,0,,0.0,0.0,-42.101
